{
  "$schema": "http://json-schema.org/draft-07/schema#",
  "$id": "https://github.com/d-oit/rust-2026-template/schema/xtask-config.schema.json",
  "title": "Xtask Configuration (config/xtask.json)",
  "description": "Typed configuration file for CI verification tiers configuration, path-based check selection, environment variable overrides, default tier selection, and lint thresholds.",
  "type": "object",
  "required": [
    "env_var_name",
    "default_tier",
    "tiers",
    "lint_thresholds"
  ],
  "properties": {
    "env_var_name": {
      "type": "string",
      "minLength": 1
    },
    "default_tier": {
      "type": "string",
      "minLength": 1
    },
    "tiers": {
      "type": "object",
      "additionalProperties": {
        "type": "object",
        "required": [
          "checks"
        ],
        "properties": {
          "checks": {
            "type": "array",
            "items": {
              "type": "string",
              "enum": [
                "LocLimits",
                "SkillValidation",
                "AdrCompliance",
                "Fmt",
                "Clippy",
                "Build",
                "Test",
                "DocTest",
                "Audit",
                "Deny",
                "Machete",
                "Msrv",
                "ShellCheck",
                "MarkdownLint",
                "YamlLint",
                "PrivacyCheck",
                "SecretScan",
                "WorkflowValidation",
                "ActionLint",
                "SkillEvals",
                "LlmContext",
                "CiStatusArtifact",
                "RoastScorer"
              ]
            }
          },
          "required_checks": {
            "type": "array",
            "items": {
              "type": "string"
            }
          }
        },
        "additionalProperties": false
      }
    },
    "when_changed": {
      "type": "object",
      "additionalProperties": {
        "type": "array",
        "items": {
          "type": "string"
        }
      }
    },
    "lint_thresholds": {
      "type": "object",
      "required": [
        "max_lines_per_file",
        "clippy_warnings_as_errors"
      ],
      "properties": {
        "max_lines_per_file": {
          "type": "integer",
          "minimum": 1
        },
        "clippy_warnings_as_errors": {
          "type": "boolean"
        }
      },
      "additionalProperties": false
    }
  },
  "additionalProperties": false
}
