{
  "env_var_name": "XTASK_TIER",
  "default_tier": "protected-branch",
  "tiers": {
    "pull-request": {
      "checks": [
        "LocLimits",
        "Fmt",
        "Clippy",
        "Build",
        "Test",
        "DocTest",
        "SkillValidation",
        "SkillEvals",
        "PrivacyCheck",
        "SecretScan",
        "WorkflowValidation"
      ]
    },
    "protected-branch": {
      "checks": [
        "LocLimits",
        "Fmt",
        "Clippy",
        "Build",
        "Test",
        "DocTest",
        "Audit",
        "Deny",
        "Machete",
        "Msrv",
        "ShellCheck",
        "MarkdownLint",
        "SkillValidation",
        "SkillEvals",
        "PrivacyCheck",
        "SecretScan",
        "WorkflowValidation",
        "CiStatusArtifact"
      ],
      "required_checks": [
        "Audit",
        "Deny",
        "Machete",
        "Msrv",
        "ShellCheck",
        "MarkdownLint",
        "WorkflowValidation",
        "SecretScan"
      ]
    },
    "scheduled": {
      "checks": [
        "SkillValidation",
        "AdrCompliance",
        "SkillEvals",
        "RoastScorer",
        "LlmContext",
        "Clippy",
        "Test",
        "Audit",
        "Deny",
        "Machete",
        "Msrv"
      ]
    },
    "release": {
      "checks": [
        "Clippy",
        "Build",
        "Test",
        "DocTest",
        "Audit",
        "Deny",
        "Machete",
        "Msrv",
        "WorkflowValidation",
        "PrivacyCheck",
        "SecretScan"
      ],
      "required_checks": [
        "Audit",
        "Deny",
        "Machete",
        "Msrv",
        "WorkflowValidation",
        "SecretScan"
      ]
    }
  },
  "when_changed": {
    "Fmt": ["crates/**/*.rs", "src/**/*.rs", "examples/**/*.rs", "tests/**/*.rs", "benchmarks/**/*.rs", "fuzz/**/*.rs", "**/Cargo.toml", "Cargo.lock", "rust-toolchain.toml"],
    "Clippy": ["crates/**/*.rs", "src/**/*.rs", "examples/**/*.rs", "tests/**/*.rs", "benchmarks/**/*.rs", "fuzz/**/*.rs", "**/Cargo.toml", "Cargo.lock", "rust-toolchain.toml"],
    "Build": ["crates/**/*.rs", "src/**/*.rs", "examples/**/*.rs", "tests/**/*.rs", "benchmarks/**/*.rs", "fuzz/**/*.rs", "**/Cargo.toml", "Cargo.lock", "rust-toolchain.toml"],
    "Test": ["crates/**/*.rs", "src/**/*.rs", "examples/**/*.rs", "tests/**/*.rs", "benchmarks/**/*.rs", "fuzz/**/*.rs", "**/Cargo.toml", "Cargo.lock", "rust-toolchain.toml"],
    "DocTest": ["crates/**/*.rs", "src/**/*.rs", "examples/**/*.rs", "tests/**/*.rs", "benchmarks/**/*.rs", "fuzz/**/*.rs", "**/Cargo.toml", "Cargo.lock", "rust-toolchain.toml"],
    "Audit": ["**/Cargo.toml", "Cargo.lock", "deny.toml", ".cargo/audit.toml"],
    "Deny": ["**/Cargo.toml", "Cargo.lock", "deny.toml"],
    "Machete": ["crates/**/*.rs", "src/**/*.rs", "examples/**/*.rs", "tests/**/*.rs", "**/Cargo.toml", "Cargo.lock"],
    "Msrv": ["crates/**/*.rs", "src/**/*.rs", "**/Cargo.toml", "Cargo.lock", "rust-toolchain.toml", "scripts/audit-msrv.sh"],
    "ShellCheck": ["scripts/**/*.sh", "**/*.sh"],
    "MarkdownLint": ["**/*.md"],
    "WorkflowValidation": [".github/workflows/*.yml", "scripts/validate-workflows.sh"],
    "SkillValidation": [".agents/skills/**", ".agents/SKILLS.md", "scripts/validate-skills.sh", ".claude/skills", ".qwen/skills"],
    "SkillEvals": [".agents/skills/**", "scripts/run-evals.sh"]
  },
  "lint_thresholds": {
    "max_lines_per_file": 500,
    "clippy_warnings_as_errors": true
  }
}
